"Global 3-Year Running Mean Ground-Level Nitrogen Dioxide (NO2) Grids from GOME, SCIAMACHY and GOME-2","Climate Change,Health & Air Quality","The Global 3-Year Running Mean Ground-Level Nitrogen Dioxide (NO2) Grids from GOME, SCIAMACHY and GOME-2 represent a series of three-year running mean grids (1996-2012) of ground level NO2 that were derived from Global Ozone Monitoring Experiment (GOME), SCanning Imaging Absorption SpectroMeter for Atmospheric CHartographY (SCIAMACHY) and Global Ozone Monitoring Experiment-2 (GOME-2) satellite retrievals. For each satellite-derived NO2 source, the relationship between satellite observations of tropospheric NO2 column densities and the NO2 concentrations at ground level relevant to human exposure is simulated, using the Goddard Earth Observing System chemical transport model (GEOS-Chem) to produce a mean NO2 concentration raster grid. The grid cell resolution is six arc-minutes (0.1 degree, or approximately 10 km at the equator) covering the global land surface.","The Global 3-Year Running Mean Ground-Level Nitrogen Dioxide (NO2) Grids from GOME, SCIAMACHY and GOME-2 represent a series of three-year running mean grids (1996-2012) of ground level NO2 that were derived from Global Ozone Monitoring Experiment (GOME), SCanning Imaging Absorption SpectroMeter for Atmospheric CHartographY (SCIAMACHY) and Global Ozone Monitoring Experiment-2 (GOME-2) satellite retrievals.",Global,"GeoTIFF, PDF, PNG, WMS",0.1 degrees,10 kilometers,,1996-01-01 to 2012-12-31,,https://doi.org/10.7927/H4JW8BTT,SDEI - Satellite-Derived Environmental Indicators,,"Lacks recent data, Large gap in dates, Only 4 years of data available",Worldview,Path B,Climate Change,Health & Air Quality,https://sciencediscoveryengine.nasa.gov/app/nasa-sba-smd/#/preview?id=%2FSDE%2FCMR_API%2F%7CC1401421022-SEDAC&query=%7B%22name%22%3A%22query-smd-primary%22%2C%22scope%22%3A%22All%22%2C%22text%22%3A%22%22%7D
Global Cyclone Proportional Economic Loss Risk Deciles,"Disasters,Human Dimensions","The Global Cyclone Proportional Economic Loss Risk Deciles is a 2.5 minute grid of cyclone hazard economic loss as proportions of Gross Domestic Product (GDP) per analytical unit. Estimates of GDP at risk are based on regional economic loss rates derived from historical records of the Emergency Events Database (EM-DAT). Loss rates are weighted by the hazard's frequency and distribution. The methodology of Sachs et al. (2003) is followed to determine baseline estimates of GDP per grid cell. To better reflect the confidence surrounding the data and procedures, the range of proportionalities is classified into deciles, 10 class of an approximately equal number of grid cells of increasing risk. This data set is the result of collaboration among the Columbia University Center for Hazards and Risk Research (CHRR), International Bank for Reconstruction and Development/The World Bank, and Columbia University Center for International Earth Science Information Network (CIESIN).",The Global Cyclone Proportional Economic Loss Risk Deciles shows cyclone hazard economic loss as a proportion of Gross Domestic Product (GDP) of an area. The shown rates are calculated based on how often and to what extend the hazard of cyclones poses to area. These data can aid in tropical storm preparation and recovery research.,Global,"ASCII, PDF, PNG, WMS",0.0417 degrees,5 kilometers,,2000-01-01 to 2000-12-31,,https://doi.org/10.7927/H44F1NNF,NDH - Natural Disaster Hotspots,Visualization available through SEDAC Map widget,Limited temporal extent,https://sedac.ciesin.columbia.edu/data/set/ndh-cyclone-proportional-economic-loss-risk-deciles/maps,Path B,Human Dimensions,Human Dimensions,https://sciencediscoveryengine.nasa.gov/app/nasa-sba-smd/#/preview?id=%2FSDE%2FCMR_API%2F%7CC179001767-SEDAC&query=%7B%22name%22%3A%22query-smd-primary%22%2C%22scope%22%3A%22All%22%2C%22text%22%3A%22%22%7D
Global Cyclone Total Economic Loss Risk Deciles,"Disasters,Human Dimensions","The Global Cyclone Total Economic Loss Risk Deciles is a 2.5 minute grid of global cyclone total economic loss risks. A process of spatially allocating Gross Domestic Product (GDP) based upon the Sachs et al. (2003) methodology is utilized. First the proportional contributions of subnational units to their respective national GDP are determined using sources of various origins. The contribution rates are then applied to published World Bank Development Indicators to determine a GDP value for the subnational unit. Once the national GDP is spatially stratified into the smallest administrative units available, GDP values for grid cells are derived using population distribution data. A per capita contribution value is determined within each subnational unit, and this value is multiplied by the population per grid cell as determined from Gridded Population of the World, Version 3 (GPWv3) data. Once a GDP value is determined on a per grid cell basis, then the regionally variable loss rate, as derived from the historical records of EM-DAT, is used to determine the total economic loss risks posed to a grid cell by cyclone hazards. The final surface does not present absolute values of total economic loss, but rather a relative decile (1-10 with increasing risk) ranking of grid cells based upon the calculated economic loss risks. This data set is the result of collaboration among the Columbia University Center for Hazards and Risk Research (CHRR), International Bank for Reconstruction and Development/The World Bank, and Columbia University Center for International Earth Science Information Network (CIESIN).",The Global Cyclone Proportional Economic Loss Risk Deciles shows the total global cyclone economic loss using the Gross Domestic Product (GDP) of an area. The economic loss is assigned a decile or rank (1-10) based on how often and to what extend the hazard of cyclones poses to area. These data can aid in tropical storm preparation and recovery research.,Global,"ASCII, DBF, PDF, PNG, WMS",0.0417 degrees,5 kilometers,,2000-01-01 to 2000-12-31,,https://doi.org/10.7927/H40P0WXQ,NDH - Natural Disaster Hotspots,Visualization available through SEDAC Map widget,Limited temporal extent,https://sedac.ciesin.columbia.edu/data/set/ndh-cyclone-total-economic-loss-risk-deciles/maps,Path B,Human Dimensions,Human Dimensions,https://sciencediscoveryengine.nasa.gov/app/nasa-sba-smd/#/preview?id=%2FSDE%2FCMR_API%2F%7CC179001764-SEDAC&query=%7B%22name%22%3A%22query-smd-primary%22%2C%22scope%22%3A%22All%22%2C%22text%22%3A%22%22%7D
"Global Development Potential Indices, v1 (2016)","Climate Change,Human Dimensions","The Global Development Potential Indices (DPIs) data set contains thirteen sector-level DPIs for sectors related to renewable energy (concentrated solar power, photovoltaic solar, wind, hydropower), fossil fuels (coal, conventional and unconventional oil and gas), mining (metallic, non-metallic), and agriculture (crop, biofuels expansion). The DPI for each sector represents land suitability that accounts for both resource potential and development feasibility. Each DPI is a 1-km spatially-explicit, global land suitability map that has been validated using locations of current and planned development, and examined for uncertainty and sensitivity. The DPIs can be used to identify lands with current favorable economic and physical conditions for individual sector expansion and assist in planning for sector and cumulative development across the globe.","The Global Development Potential Indices, v1 (2016) dataset provides Development Potential Indices for sectors related to renewable energy, fossil fuels, mining, and agriculture. Each DPI shows how suitable land is for the potential land use sector. These data may aid in urban sprawl and human impacts research.",Global,"GeoTIFF, PDF, PNG, WMS",30 degrees,3500 kilometers,,2016-01-01 to 2016-12-31,,https://doi.org/10.7927/k9t6-gh59,LULC - Land Use and Land Cover,GeoTIFF format for GIS,Lacks recent data,,Path B,Climate Change,Human Dimensions,https://sciencediscoveryengine.nasa.gov/app/nasa-sba-smd/#/preview?id=%2FSDE%2FCMR_API%2F%7CC1739457324-SEDAC&query=%7B%22name%22%3A%22query-smd-primary%22%2C%22scope%22%3A%22All%22%2C%22text%22%3A%22%22%7D
"Global Estimated Net Migration Grids By Decade, v1 (1970 – 2000)","Food Availability,Human Dimensions","The Global Estimated Net Migration by Decade: 1970-2000 data set provides estimates of net migration over the three decades from 1970 to 2000. Because of the lack of globally consistent data on migration, indirect estimation methods were used. The authors relied on a combination of data on spatial population distribution for four time slices (1970, 1980, 1990, and 2000) and subnational rates of natural increase in order to derive estimates of net migration on a 30 arc-second (~1km) grid cell basis. Net migration was estimated by subtracting the population in time period 2 from the population in time period 1, and then subtracting the natural increase (births minus deaths). The residual was considered to be net migration (in-migrants minus out-migrants). The authors ran 13 geospatial net migration estimation models based on outputs from the same number of imputation runs for urban and rural rates of natural increase.This data set represents the average of those runs. These data are reliable at broad scales of analysis (e.g. ecosystems or regions), but are generally not reliable for local level analyses. The data were produced for the United Kingdom Foresight project on Migration and Global Environmental Change.","The Global Estimated Net Migration Grids By Decade provides estimates of overall net migration (in-migration minus out-migration) per decade for the 1970s, 1980s, and 1990s.",Global,"GeoTIFF, PDF, PNG, WMS",0.00833 degrees,1 kilometer,,1970-01-01 to 2000-12-31,,https://doi.org/10.7927/H4319SVC,POPDYNAMICS - Population Dynamics,30-year temporal extent,Lacks recent data,SEDAC map widget,Path B,Food Availability,Human Dimensions,https://sciencediscoveryengine.nasa.gov/app/nasa-sba-smd/#/preview?id=%2FSDE%2FCMR_API%2F%7CC1000000660-SEDAC&query=%7B%22name%22%3A%22query-smd-primary%22%2C%22scope%22%3A%22All%22%2C%22text%22%3A%22%22%7D
Global Flood Proportional Economic Loss Risk Deciles,"Disasters,Human Dimensions","The Global Flood Proportional Economic Loss Risk Deciles is a 2.5 minute grid of flood hazard economic loss as proportions of Gross Domestic Product (GDP) per analytical unit. Estimates of GDP at risk are based on regional economic loss rates derived from historical records of the Emergency Events Database (EM-DAT). Loss rates are weighted by the hazard's frequency and distribution. The methodology of Sachs et al. (2003) is followed to determine baseline estimates of GDP per grid cell. To better reflect the confidence surrounding the data and procedures, the range of proportionalities is classified into deciles, 10 class of an approximately equal number of grid cells of increasing risk. This data set is the result of collaboration among the Columbia University Center for Hazards and Risk Research (CHRR), International Bank for Reconstruction and Development/The World Bank, and Columbia University Center for International Earth Science Information Network (CIESIN).",The Global Flood Proportional Economic Loss Risk Deciles shows flood hazard economic loss as a proportion of Gross Domestic Product (GDP) of an area. The shown rates are calculated based on how often and to what extend the hazard of floods poses to area. These data can aid in storm preparation and recovery research.,Global,"ASCII, PDF, PNG, WMS",0.0417 degrees,5 kilometers,,2000-01-01 to 2000-12-31,,https://doi.org/10.7927/H4XS5S9Q,NDH - Natural Disaster Hotspots,Visualization available through SEDAC Map widget,Limited temporal extent,https://sedac.ciesin.columbia.edu/data/set/ndh-flood-proportional-economic-loss-risk-deciles/maps,Path B,Disasters,Human Dimensions,https://sciencediscoveryengine.nasa.gov/app/nasa-sba-smd/#/preview?id=%2FSDE%2FCMR_API%2F%7CC179001781-SEDAC&query=%7B%22name%22%3A%22query-smd-primary%22%2C%22scope%22%3A%22All%22%2C%22text%22%3A%22%22%7D
Global Flood Total Economic Loss Risk Deciles,"Disasters,Human Dimensions","The Global Flood Total Economic Loss Risk Deciles is a 2.5 minute grid of global flood total economic loss risks. A process of spatially allocating Gross Domestic Product (GDP) based upon the Sachs et al. (2003) methodology is utilized. First the proportional contributions of subnational units to their respective national GDP are determined using sources of various origins. The contribution rates are then applied to published World Bank Development Indicators to determine a GDP value for the subnational unit. Once the national GDP has been spatially stratified into the smallest administrative units available, GDP values for grid cells are derived using Gridded Population of the World, Version 3 (GPWv3) data of population distributions. A per capita contribution value is determined within each subnational unit, and this value is multiplied by the population per grid cell. Once a GDP value has been determined on a per grid cell basis, then the regionally variable loss rate as derived from the historical records of EM-DAT is used to determine the total economic loss risks posed to a grid cell by flood hazards. The final surface does not present absolute values of total economic loss, but rather a relative decile (1-10 with increasing risk) ranking of grid cells based upon the calculated economic loss risks. This data set is the result of collaboration among the Columbia University Center for Hazards and Risk Research (CHRR), International Bank for Reconstruction and Development/The World Bank, and Columbia University Center for International Earth Science Information Network (CIESIN).",The Global Flood Proportional Economic Loss Risk Deciles shows the total global flood economic loss using the Gross Domestic Product (GDP) of an area. The economic loss is assigned a decile or rank (1-10) based on how often and to what extend the hazard of floods poses to area. These data can aid in storm preparation and recovery research.,Global,"ASCII, DBF, PDF, PNG, WMS",0.0417 degrees,5 kilometers,,2000-01-01 to 2000-12-31,,https://doi.org/10.7927/H4T151KP,NDH - Natural Disaster Hotspots,Visualization available through SEDAC Map widget,Limited temporal extent,https://sedac.ciesin.columbia.edu/data/set/ndh-flood-total-economic-loss-risk-deciles/maps,Path B,Disasters,Human Dimensions,https://sciencediscoveryengine.nasa.gov/app/nasa-sba-smd/#/preview?id=%2FSDE%2FCMR_API%2F%7CC179001780-SEDAC&query=%7B%22name%22%3A%22query-smd-primary%22%2C%22scope%22%3A%22All%22%2C%22text%22%3A%22%22%7D
"Global Food Security-support Analysis Data (GFSAD) Cropland Extent 2015 Australia, New Zealand, China, Mongolia 30 m V001",Food Availability,"The NASA Making Earth System Data Records for Use in Research Environments (MEaSUREs) (https://earthdata.nasa.gov/community/community-data-system-programs/measures-projects) Global Food Security-support Analysis Data (GFSAD) data product provides cropland extent data over Australia, New Zealand, China, and Mongolia for nominal year 2015 at 30 meter resolution (GFSAD30AUNZCNMOCE). The monitoring of global cropland extent is critical for policymaking and provides important baseline data that are used in many agricultural cropland studies pertaining to water sustainability and food security.","The Global Food Security-support Analysis Data (GFSAD) Cropland Extent 2015 Australia, New Zealand, China, Mongolia 30 m V001 dataset provides cropland extent data over Australia, New Zealand, China, and Mongolia for the year 2015. These data may be useful in agricultural cropland studies related to water sustainability and food security.","Australia, New Zealand, China, Mongolia",GeoTIFF,30m,30 meters,,2013-01-01 to 2016-12-31,,https://doi.org/10.5067/MEaSUREs/GFSAD/GFSAD30AUNZCNMOCE.001,MEaSUREs - Making Earth System Data Records for Use in Research Environments,,Lacks recent data,,Path C,Food Availability,Food Availability,https://sciencediscoveryengine.nasa.gov/app/nasa-sba-smd/#/preview?id=%2FSDE%2FCMR_API%2F%7CC1431392676-LPDAAC_ECS&query=%7B%22name%22%3A%22query-smd-primary%22%2C%22scope%22%3A%22All%22%2C%22text%22%3A%22%22%7D
"Global Food Security-support Analysis Data (GFSAD) Cropland Extent 2015 Europe, Central Asia, Russia, Middle East product 30 m V001","Food Availability,Water Availability","The NASA Making Earth System Data Records for Use in Research Environments (MEaSUREs) Global Food Security-support Analysis Data (GFSAD) data product provides cropland extent data over Europe, Central Asia, Russia and the Middle East for nominal year 2015 at 30 meter resolution (GFSAD30EUCEARUMECE). The monitoring of global cropland extent is critical for policymaking and provides important baseline data that are used in many agricultural cropland studies pertaining to water sustainability and food security.","The Global Food Security-support Analysis Data (GFSAD) Cropland Extent 2015 Europe, Central Asia, Russia, Middle East product 30 m V001 dataset provides cropland extent data for Europe, Central Asia, Russia, and the Middle East for the year 2015. These data may be useful in agricultural cropland studies related to water sustainability and food security.","Europe, Asia",GeoTIFF,30m,30 meters,,2013-01-01 to 2016-12-31,,https://doi.org/10.5067/MEaSUREs/GFSAD/GFSAD30EUCEARUMECE.001,MEaSUREs - Making Earth System Data Records for Use in Research Environments,Includes all of Northern Hemisphere,Lacks recent data,,Path C,Water Availability,Food Availability,https://sciencediscoveryengine.nasa.gov/app/nasa-sba-smd/#/preview?id=%2FSDE%2FCMR_API%2F%7CC1431401246-LPDAAC_ECS&query=%7B%22name%22%3A%22query-smd-primary%22%2C%22scope%22%3A%22All%22%2C%22text%22%3A%22%22%7D
Global Food Security-support Analysis Data (GFSAD) Cropland Extent 2015 South America product 30 m V001,Food Availability,The NASA Making Earth System Data Records for Use in Research Environments (MEaSUREs) Global Food Security-support Analysis Data (GFSAD) data product provides cropland extent data over South America for nominal year 2015 at 30 meter resolution (GFSAD30SACE). The monitoring of global cropland extent is critical for policymaking and provides important baseline data that are used in many agricultural cropland studies pertaining to water sustainability and food security.,"The Global Food Security-support Analysis Data (GFSAD) Cropland Extent 2015 Europe, Central Asia, Russia, Middle East product 30 m V001 dataset provides cropland extent data for South America for the year 2015. These data may be useful in agricultural cropland studies related to water sustainability and food security.",South America,GeoTIFF,30m,30 meters,,2013-01-01 to 2016-12-31,,https://doi.org/10.5067/MEaSUREs/GFSAD/GFSAD30SACE.001,MEaSUREs - Making Earth System Data Records for Use in Research Environments,,"Lacks recent data, Limited to South America",,Path C,Food Availability,Food Availability,https://sciencediscoveryengine.nasa.gov/app/nasa-sba-smd/#/preview?id=%2FSDE%2FCMR_API%2F%7CC1431432916-LPDAAC_ECS&query=%7B%22name%22%3A%22query-smd-primary%22%2C%22scope%22%3A%22All%22%2C%22text%22%3A%22%22%7D
Global Food Security-support Analysis Data (GFSAD) Cropland Extent 2015 Southeast and Northeast Asia product 30 m V001,"Food Availability,Water Availability",The NASA Making Earth System Data Records for Use in Research Environments (MEaSUREs) Global Food Security-support Analysis Data (GFSAD) data product provides cropland extent data over Southeast and Northeast Asia for nominal year 2015 at 30 meter resolution (GFSAD30SEACE). The monitoring of global cropland extent is critical for policymaking and provides important baseline data that are used in many agricultural cropland studies pertaining to water sustainability and food security.,The Global Food Security-support Analysis Data (GFSAD) Cropland Extent 2015 Southeast and Northeast Asia product 30 m V001 dataset provides cropland extent data over Southeast and Northeast Asia for the year 2015. These data may be useful in agricultural cropland studies related to water sustainability and food security.,"Southeastern Asia, Eastern Asia",GeoTIFF,30m,30 meters,,2013-01-01 to 2016-12-31,,https://doi.org/10.5067/MEaSUREs/GFSAD/GFSAD30SEACE.001,MEaSUREs - Making Earth System Data Records for Use in Research Environments,,Lacks recent data,,Path C,Water Availability,Food Availability,https://sciencediscoveryengine.nasa.gov/app/nasa-sba-smd/#/preview?id=%2FSDE%2FCMR_API%2F%7CC1431439087-LPDAAC_ECS&query=%7B%22name%22%3A%22query-smd-primary%22%2C%22scope%22%3A%22All%22%2C%22text%22%3A%22%22%7D
"Global Gridded Geographically Based Economic Data (G-Econ), v4 (1990, 1995, 2000, 2005)",Human Dimensions,"The Global Gridded Geographically Based Economic Data (G-Econ), Version 4 contains derived one degree grid cells of Gross Domestic Product (GDP) data in Grid and ASCII formats for both Market Exchange Rate (MER) and Purchasing Power Parity (PPP) for the years 1990, 1995, 2000 and 2005. MER is the exchange rate between local and U.S. dollar currencies for a given time period established by the market. PPP is the exchange rate between a country's currency and U.S. dollars adjusted to reflect the actual cost in U.S. dollars of purchasing a standardized market basket of goods in that country using the country's currency. The original data from the G-Econ Project at Yale University is also available in tabular format and includes latitude and longitude geographic coordinates of the grid cells, area of grid cells, as well as country names, distance to coast, elevation, vegetation, population, precipitation and temperature.","The Global Gridded Geographically Based Economic Data (G-Econ), v4 (1990, 1995, 2000, 2005) dataset provides global GDP economic data based on the state of the market in each subsequent year.",Global,"ASCII, Grid, Excel, PDF, PNG",1.0 degree,111 kilometers,,"1990-01-01, 1995-01-01, 2000-01-01, 2005-01-01",,https://doi.org/10.7927/H42V2D1C,SPATIALECON - Spatial Economic Data,33-year temporal extent,Lacks recent data,,Path B,Human Dimensions,Human Dimensions,https://sciencediscoveryengine.nasa.gov/app/nasa-sba-smd/#/preview?id=%2FSDE%2FCMR_API%2F%7CC1419865113-SEDAC&query=%7B%22name%22%3A%22query-smd-primary%22%2C%22scope%22%3A%22All%22%2C%22text%22%3A%22%22%7D
"Global Gridded Relative Deprivation Index (GRDI), Version 1","Food Availability,Human Dimensions","The Global Gridded Relative Deprivation Index (GRDI), Version 1 (GRDIv1) data set characterizes the relative levels of multidimensional deprivation and poverty in each 30 arc-second (~1 km) pixel, where a value of 100 represents the highest level of deprivation and a value of 0 the lowest. GRDIv1 is built from sociodemographic and satellite data inputs that were spatially harmonized, indexed, and weighted into six main components to produce the final index raster. Inputs were selected from the best-available data that either continuously vary across space or have at least administrative level 1 (provincial/state) resolution, and which have global spatial coverage.","The Global Gridded Relative Deprivation Index (GRDI), Version 1 (GRDIv1) data set characterizes the relative levels of multidimensional deprivation and poverty in each 30 arc-second (~1 km) pixel, where a value of 100 represents the highest level of deprivation and a value of 0 the lowest.",Global,"GeoTIFF, PDF, PNG",1 kilometer,1 kilometer,,2010-01-01 to 2020-12-31,,https://doi.org/10.7927/3xxe-ap97,PMP - Poverty Mapping Project,,,,Path B,Food Availability,Human Dimensions,https://sciencediscoveryengine.nasa.gov/app/nasa-sba-smd/#/preview?id=%2FSDE%2FCMR_API%2F%7CC2552888508-SEDAC&query=%7B%22name%22%3A%22query-smd-primary%22%2C%22scope%22%3A%22All%22%2C%22text%22%3A%22%22%7D
Global High Resolution Daily Extreme Urban Heat Exposure,Extreme Heat,"The Global High Resolution Daily Extreme Urban Heat Exposure (UHE-Daily), 1983-2016 data set contains a high-resolution, longitudinal global record of geolocated urban extreme heat events and urban population exposure estimates for more than 10,000 urban settlements worldwide for 1983-2016. Urban extreme heat events and urban population exposure are identified for each urban settlement in the data record for five combined temperature-humidity thresholds: two-day or longer periods where the daily maximum Heat Index (HImax) > 40.6 °C; one-day or longer periods where HImax > 46.1 °C; and one day or longer periods where the daily maximum Wet Bulb Globe Temperature (WBGTmax) > 28 °C, 30 °C, and 32 °C. The WBGTmax thresholds follow the International Standards Organization (ISO) criteria for risk of occupational heat related heat illness, whereas the HImax thresholds follow the U.S. National Weather Services' definition for an excessive heat warning. For each criteria, across urban settlements worldwide, the data set also contains the duration, intensity, and severity of each urban extreme heat event.","The Global High Resolution Daily Extreme Urban Heat Exposure (UHE-Daily) dataset contains a record of urban extreme heat events and exposure estimates for over 10,000 urban settlements worldwide for the years 1983-2016.",Global,"Shapefile, CSV, JSON",N/A,,N/A,1983-01-01 to 2016-12-31,,https://doi.org/10.7927/fq7g-ny13,SDEI - Satellite-Derived Environmental Indicators,33-year temporal extent,Lacks recent data,,Path B,Extreme Heat,Extreme Heat,https://sciencediscoveryengine.nasa.gov/app/nasa-sba-smd/#/preview?id=%2FSDE%2FCMR_API%2F%7CC2175347697-SEDAC&query=%7B%22name%22%3A%22query-smd-primary%22%2C%22scope%22%3A%22All%22%2C%22text%22%3A%22%22%7D
