"Global Man-made Impervious Surface (GMIS) Dataset From Landsat, v1 (2010)",Extreme Heat,"The Global Man-made Impervious Surface (GMIS) Dataset From Landsat consists of global estimates of fractional impervious cover derived from the Global Land Survey (GLS) Landsat dataset for the target year 2010. The GMIS dataset consists of two components: 1) global percent of impervious cover; and 2) per-pixel associated uncertainty for the global impervious cover. These layers are co-registered to the same spatial extent at a common 30m spatial resolution. The spatial extent covers the entire globe except Antarctica and some small islands. This dataset is one of the first global, 30m datasets of man-made impervious cover to be derived from the GLS data for 2010 and is a companion dataset to the Global Human Built-up And Settlement Extent (HBASE) dataset. The dataset is expected to have a rather broad spectrum of users, from those wishing to examine/study the fine details of urban land cover over the globe at full 30m resolution to global modelers trying to understand the climate/environmental impacts of man-made surfaces at continental to global scales. For example, the data are applicable to local modeling studies of urban impacts on the energy, water, and carbon cycles, as well as analyses at the individual country level.",The Global Man-made Impervious Surface (GMIS) Dataset From Landsat consists of global estimates of fractional impervious cover derived from the Global Land Survey (GLS) Landsat dataset for the target year 2010. These data show the extent of land cover that does not absorb water such as concrete and roads. These data may aid in urban flooding and urban heat research.,Global,"GeoTIFF, PDF, PNG, WMS",30m,30 meters,,2010-01-01 to 2010-12-31,,https://doi.org/10.7927/H4P55KKF,ULANDSAT - Global High Resolution Urban Data from Landsat,Makes landsat data more user-friendly,Lacks recent data,https://sedac.ciesin.columbia.edu/data/set/ulandsat-gmis-v1/maps,Path B,Extreme Heat,Extreme Heat,https://sciencediscoveryengine.nasa.gov/app/nasa-sba-smd/#/preview?id=%2FSDE%2FCMR_API%2F%7CC1517102461-SEDAC&query=%7B%22name%22%3A%22query-smd-primary%22%2C%22scope%22%3A%22All%22%2C%22text%22%3A%22%22%7D
"Global Mean Sea Level Trend from Integrated Multi-Mission Ocean Altimeters TOPEX/Poseidon, Jason-1, OSTM/Jason-2, and Jason-3 Version 5.1",Climate Change,"This dataset contains the Global Mean Sea Level (GMSL) trend generated from the Integrated Multi-Mission Ocean Altimeter Data for Climate Research Version 5.1. The GMSL trend is a 1-dimensional time series of globally averaged Sea Surface Height Anomalies (SSHA) from TOPEX/Poseidon, Jason-1, OSTM/Jason-2, and Jason-3 that covers September 1992 to present with a lag of up to 4 months. The data are reported as variations relative to a 20-year TOPEX/Jason collinear mean. Bias adjustments and cross-calibrations were applied to ensure SSHA data are consistent across the missions; Glacial Isostatic Adjustment (GIA) was also applied. The data are available as a table in ASCII format. Changes between the version 4.2 and version 5.x releases are described in detail in the user handbook.","The Global Mean Sea Level Trend from Integrated Multi-Mission Ocean Altimeters TOPEX/Poseidon, Jason-1, OSTM/Jason-2, and Jason-3 Version 5.1 dataset provides Global Mean Sea Level (GMSL) estimates.",Global,ASCII,,,Weekly - < Monthly,1992-09-01 to Present,4 months,https://dx.doi.org/10.5067/GMSLM-TJ151,MEaSUREs - Making Earth System Data Records for Use in Research Environments,Recent data available,Low latency,,Path C,Climate Change,Climate Change,https://sciencediscoveryengine.nasa.gov/app/nasa-sba-smd/#/preview?id=%2FSDE%2FCMR_API%2F%7CC2205556193-POCLOUD&query=%7B%22name%22%3A%22query-smd-primary%22%2C%22scope%22%3A%22All%22%2C%22text%22%3A%22%22%7D
Global Multihazard Proportional Economic Loss Risk Deciles,"Disasters,Climate Change,Human Dimensions","The Global Multihazard Proportional Economic Loss Risks is a 2.5 minute grid of a multihazard-based economic loss risk as a proportion of the economic productivity of the analytical unit, the grid cell. Representation of multihazard risk is not based on a multihazard index but rather on combinations of hazard risk categories, drought, seismic, and hydro. The drought category includes drought only. The seismic category consists of earthquake and volcano hazards. Cyclones, floods, and landslides are included in the hydro category. For each of the six hazards considered, a binary risk surface is constructed utilizing the three most-at-risk deciles of each hazard's global proportional economic loss risks data set (deciles 8-10). Each of the category risk surfaces are constructed by adding all the relevant hazard high-risk surfaces. These categorical risk surfaces are reclassified into binary high-risk surfaces. The combination of the category risk values forms a three digit identifier for determining those locations that are at higher-risk from multihazards. This data set is the result of collaboration among the Columbia University Center for Hazards and Risk Research (CHRR), International Bank for Reconstruction and Development/The World Bank, and Columbia University Center for International Earth Science Information Network (CIESIN).","The Global Multihazard Proportional Economic Loss Risks shows the multihazard-based economic loss risk as a proportion of economic productivity. In other words, several different hazards are combined and a proportion is created with the economic productivity of an area. These hazards include drought, earthquakes, volcanoes, cyclones, landslides, and flood risk.",Global,"ASCII, DBF, PDF, PNG",0.0417 degrees,5 kilometers,,2000-01-01 to 2000-12-31,,https://doi.org/10.7927/H4WS8R5B,NDH - Natural Disaster Hotspots,Visualization available through SEDAC Map widget,Limited temporal extent,https://sedac.ciesin.columbia.edu/data/set/ndh-multihazard-proportional-economic-loss-risk-deciles/maps,Path B,Climate Change,Human Dimensions,https://sciencediscoveryengine.nasa.gov/app/nasa-sba-smd/#/preview?id=%2FSDE%2FCMR_API%2F%7CC179001790-SEDAC&query=%7B%22name%22%3A%22query-smd-primary%22%2C%22scope%22%3A%22All%22%2C%22text%22%3A%22%22%7D
Global Multihazard Total Economic Loss Risk Deciles,"Disasters,Climate Change,Human Dimensions","The Global Multihazard Total Economic Loss Risk Deciles is a 2.5 minute grid of global multihazard total economic loss risks. First, for each of the considered hazards (cyclones, droughts, earthquakes, floods, landslides, and volcanoes), subnational distributions of Gross Domestic Product (GDP) are computed using a methodology developed from Sachs et al. (2003). Where applicable, the contributions of subnational units to national GDP estimates, the contribution ratio, are determined using data of varied origin. World Bank Development Indicators are substituted for GDP estimates of varied origin and the subnational GDP is estimated using the fore mentioned contribution ratios. A subnational, per capita GDP is derived and a final GDP estimate per grid cell is made based on grid cell population density. A raw, total economic loss is computed per grid cell using a regional economic loss rate derived from EM-DAT records. To more accurately reflect the confidence surrounding the economic loss estimate, the range of losses are classified into deciles, 10 classes of an approximately equal number of grid cells. A multihazard index is generated by summing the top three deciles of the individual hazards. This data set is the result of collaboration among the Columbia University Center for Hazards and Risk Research (CHRR), International Bank for Reconstruction and Development/The World Bank, and Columbia University Center for International Earth Science Information Network (CIESIN).","The Global Multihazard Proportional Economic Loss Risks shows the total economic loss risk by combining the risk of several types of hazards. These hazards include drought, earthquakes, volcanoes, cyclones, landslides, and flood risk. This dataset may aid disaster preparation and recovery research.",Global,"ASCII, DBF, PDF, PNG",0.0417 degrees,5 kilometers,,2000-01-01 to 2000-12-31,,https://doi.org/10.7927/H4S180F9,NDH - Natural Disaster Hotspots,Visualization available through SEDAC Map widget,Limited temporal extent,https://sedac.ciesin.columbia.edu/data/set/ndh-multihazard-total-economic-loss-risk-deciles/maps,Path B,Disasters,Human Dimensions,https://sciencediscoveryengine.nasa.gov/app/nasa-sba-smd/#/preview?id=%2FSDE%2FCMR_API%2F%7CC179001788-SEDAC&query=%7B%22name%22%3A%22query-smd-primary%22%2C%22scope%22%3A%22All%22%2C%22text%22%3A%22%22%7D
Global Nitrogen Dioxide Monitoring,"Climate Change,Health & Air Quality","NO2 column observations from the Dutch-Finnish Ozone Monitoring Instrument (OMI) and ESA/EU Copernicus Sentinel 5 Precursor TROPOspheric Monitoring Instrument (TROPOMI) are available from October, 2004 and April, 2018, respectively. OMI is a UV-Visible wavelength spectrometer on the polar-orbiting NASA Aura satellite. Aura, launched on 15 July 2004, follows a sun-synchronous orbit with an equator crossing time near 13:45, local time. TROPOMI is a similar instrument with enhanced spatial resolution and additional spectral coverage. It was launched on board the European Space Agency/European Union (ESA/EU) Copernicus Sentinel-5 Precursor satellite on October 13, 2017.",The Global Nitrogen Dioxide Monitoring dataset provides imagery of daily nitrogen dioxide from OMI. These data may aid in air quality research.,Global,,0.1 degrees,10 kilometers,Daily - < Weekly,Varies,,https://so2.gsfc.nasa.gov/no2/no2_index.html,"Aura - Earth Observing System (EOS), Aura",Images useful for Path A users,No data download,Map Viewer,Path B,Climate Change,Health & Air Quality,
"Global One-Eighth Degree Urban Land Extent Projection and Base Year Grids by SSP Scenarios, v1 (2000 – 2100)","Food Availability,Human Dimensions","The Global One-Eighth Degree Urban Land Extent Projection and Base Year Grids by SSP Scenarios, 2000-2100 consists of global SSP-consistent spatial urban land fraction data for the base year 2000 and projections at ten-year intervals for 2010-2100 at a resolution of one-eighth degree (7.5 arc-minutes). Spatial urban land projections are key inputs for the analysis of land use, energy use, and emissions, as well as for the assessment of climate change vulnerability, impacts and adaptation. This data set presents a set of global, spatially explicit urban land scenarios that are consistent with the Shared Socioeconomic Pathways (SSPs) to produce an empirically-grounded set of urban land spatial distributions over the 21st century. A data-science approach is used exploiting 15 diverse data sets, including a newly available 40-year global time series of fine-spatial-resolution remote sensing observations from the Landsat satellite series. The SSPs are developed to support future climate and global change research, the Intergovernmental Panel on Climate Change (IPCC) Sixth Assessment Report (AR6), along with Special Reports.","The Global One-Eighth Degree Urban Land Extent Projection and Base Year Grids by SSP Scenarios dataset provides global urban land projections based on the SSP (Shared Socioeconomic Pathways) data. These data may be useful in climate, socioeconomic, environmental, or other related research.",Global,"GeoTIFF, netCDF-4, PDF, PNG",7.5 Arc-Minutes,15 kilometers,,2000-01-01 to 2100-12-31,,https://doi.org/10.7927/nj0x-8y67,SSP - Shared Socioeconomic Pathways,Includes past data and projections,Projections based on original publishing date,SEDAC Map widget,Path B,Food Availability,Human Dimensions,https://sciencediscoveryengine.nasa.gov/app/nasa-sba-smd/#/preview?id=%2FSDE%2FCMR_API%2F%7CC2205031324-SEDAC&query=%7B%22name%22%3A%22query-smd-primary%22%2C%22scope%22%3A%22All%22%2C%22text%22%3A%22%22%7D
"Global Pesticide Grids (PEST-CHEMGRIDS), v1.01 (2015, 2020, 2025)",Health & Air Quality,"The Global Pesticide Grids (PEST-CHEMGRIDS), Version 1.01 data set contains 20 of the most-used pesticide active ingredients on 6 dominant crops and 4 aggregated crop classes at 5 arc-minute resolution (about 10 km at the equator), estimated in year 2015, and then projected to 2020 and 2025. To estimate the global application rates of specific active ingredients, spatial statistical methods were used to re-analyze the U.S. Geological Survey Pesticide National Synthesis Project (USGS/PNSP) and the Food and Agriculture Organization Corporate Statistical Database (FAOSTAT) pesticide databases, along with other public inventories including globally gridded data of soil physical properties, hydro-climatic variables, agricultural quantities, and socioeconomic indices. The application rate (APR) of each active ingredient on each crop is in kilogram per hectare per year (kg/ha-year), and the harvest area of each crop is in hectare (ha). The data set also includes 200 data quality index maps corresponding to each active ingredient on each crop, as well as maps of the 10 dominant crops and 4 aggregated crop classes. Version 1.01 includes data in GeoTIFF and netCDF formats.","The Global Pesticide Grids (PEST-CHEMGRIDS) dataset provides commonly-used pesticides crucial to assess humanand ecosystem exposure to potential toxicants for environmental modeling, assessment of agricultural chemical contamination and risk analysis, and other related research for the years 2015, 2020, and 2025.",Global,"GeoTIFF, netCDF-4, PDF, PNG, WMS",5 Arc-Minutes,10 kilometers,,"2015-01-01, 2020-01-01, 2025-01-01",,https://doi.org/10.7927/weq9-pv30,FERMANV1 - Global Agricultural Inputs,Includes past and recent data and data projections,No data prior to 2015,SEDAC Map widget,Path B,Health & Air Quality,Health & Air Quality,https://sciencediscoveryengine.nasa.gov/app/nasa-sba-smd/#/preview?id=%2FSDE%2FCMR_API%2F%7CC1947982144-SEDAC&query=%7B%22name%22%3A%22query-smd-primary%22%2C%22scope%22%3A%22All%22%2C%22text%22%3A%22%22%7D
Global Precipitation Measurement Data Directory,Urban Flooding,"Precipitation data from the GPM and TRMM missions are made available free to the public in a variety of formats from several sources at NASA Goddard Space Flight Center. This section outlines the different types of data available, the levels of processing, the sources to download the data, and some helpful tips for utilizing precipitation data in your research.",The Global Precipitation Measurement Data Directory includes various datasets related to precipitation and atmospheric monitoring.,Global,Varies,Varies,Varies,Varies,Varies,Varies,https://gpm.nasa.gov/data/directory,GPM - Global Precipitation Measurement,Multiple datasets available,,"visualization avaible, varies per dataset",Path B,Urban Flooding,Urban Flooding,
"Global Reservoir and Dam Database, Version 1 (GRanDv1): Dams, Revision 01",Water Availability,"The Global Reservoir and Dam Database, Version 1, Revision 01 (v1.01) contains 6,862 records of reservoirs and their associated dams with a cumulative storage capacity of 6,197 cubic km. The dams were geospatially referenced and assigned to polygons depicting reservoir outlines at high spatial resolution. Dams have multiple attributes, such as name of the dam and impounded river, primary use, nearest city, height, area and volume of reservoir, and year of construction (or commissioning). While the main focus was to include all dams associated with reservoirs that have a storage capacity of more than 0.1 cubic kilometers, many smaller dams and reservoirs were added where data were available. The data were compiled by Lehner et al. (2011) and are distributed by the Global Water System Project (GWSP) and by the Columbia University Center for International Earth Science Information Network (CIESIN). For details please refer to the Technical Documentation which is provided with the data.","The Global Reservoir and Dam Database, Version 1, Revision 01 (v1.01) dataset contains 6,862 records of reservoirs and their associated dams with a cumulative storage capacity of 6,197 cubic km. Information available for each dam include the name of the dam and impounded river, primary use, nearest city, height, area and volume of reservoir, and year of construction (or commissioning). These data may aid in water availability research.",Global,"Shapefile, PDF, PNG, WMS",,,,2011-01-01 to 2011-12-31,,https://doi.org/10.7927/H4N877QK,GRAND - Global Reservoir and Dam Database,Shapefile format for use in GIS,Lacks recent data,,Path B,Water Availability,Water Availability,https://sciencediscoveryengine.nasa.gov/app/nasa-sba-smd/#/preview?id=%2FSDE%2FCMR_API%2F%7CC2210186323-SEDAC&query=%7B%22name%22%3A%22query-smd-primary%22%2C%22scope%22%3A%22All%22%2C%22text%22%3A%22%22%7D
"Global Reservoir and Dam Database, Version 1 (GRanDv1): Reservoirs, Revision 01",Water Availability,"Global Reservoir and Dam Database, Version 1, Revision 01 (v1.01) contains 6,862 records of reservoirs and their associated dams with a cumulative storage capacity of 6,197 cubic km. The reservoirs were delineated from high spatial resolution satellite imagery and are available as polygon shape files. The only attribute for the reservoirs is the area of the reservoir. The associated dams data set includes multiple attributes such as name of the dam and the impounded river, primary use, nearest city, area, and year of construction (or commissioning). While the main focus was to include all reservoirs with a storage capacity of more than 0.1 cubic kilometers, many smaller reservoirs were added where data were available. The data were compiled by Lehner et al. (2011) and are distributed by the Global Water System Project (GWSP) and by the Columbia University Center for International Earth Science Information Network (CIESIN). For details please refer to the Technical Documentation which is provided with the data.","The Global Reservoir and Dam Database, Version 1, Revision 01 (v1.01) dataset contains 6,862 records of reservoirs and their associated dams with a cumulative storage capacity of 6,197 cubic km. This dataset provides the area of each reservoir. These data may aid in water availability research.",Global,"Shapefile, PDF, PNG, WMS",,,,2011-01-01 to 2011-12-31,,https://doi.org/10.7927/H4HH6H08,GRAND - Global Reservoir and Dam Database,Global coverage and shapefile format for GIS,Lacks recent data,SEDAC Map widget,Path B,Water Availability,Water Availability,https://sciencediscoveryengine.nasa.gov/app/nasa-sba-smd/#/preview?id=%2FSDE%2FCMR_API%2F%7CC2210194026-SEDAC&query=%7B%22name%22%3A%22query-smd-primary%22%2C%22scope%22%3A%22All%22%2C%22text%22%3A%22%22%7D
"Global Roads Open Access Data Set (gROADS), v1 (1980 – 2010)",Human Dimensions,"The Global Roads Open Access Data Set, Version 1 (gROADSv1) was developed under the auspices of the CODATA Global Roads Data Development Task Group. The data set combines the best available roads data by country into a global roads coverage, using the UN Spatial Data Infrastructure Transport (UNSDI-T) version 2 as a common data model. All country road networks have been joined topologically at the borders, and many countries have been edited for internal topology. Source data for each country are provided in the documentation, and users are encouraged to refer to the readme file for use constraints that apply to a small number of countries. Because the data are compiled from multiple sources, the date range for road network representations ranges from the 1980s to 2010 depending on the country (most countries have no confirmed date), and spatial accuracy varies. The baseline global data set was compiled by the Information Technology Outreach Services (ITOS) of the University of Georgia. Updated data for 27 countries and 6 smaller geographic entities were assembled by Columbia University's Center for International Earth Science Information Network (CIESIN), with a focus largely on developing countries with the poorest data coverage.","The Global Roads Open Access Data Set (gROADS), v1 (1980 – 2010) dataset provides global roads coverage using UN data.",Global,"Shapefile, Geodatabase, PDF, PNG",,,,1980-01-01 to 2010-12-31,,https://doi.org/10.7927/H4VD6WCT,GROADS - Global Roads Open Access Data Set,Global coverage and shapefile format for GIS,Lacks recent data,,Path B,Human Dimensions,Human Dimensions,https://sciencediscoveryengine.nasa.gov/app/nasa-sba-smd/#/preview?id=%2FSDE%2FCMR_API%2F%7CC1000000202-SEDAC&query=%7B%22name%22%3A%22query-smd-primary%22%2C%22scope%22%3A%22All%22%2C%22text%22%3A%22%22%7D
"Global Rural-Urban Mapping Project (GRUMP) Urban Extent Polygons, v1","Food Availability,Human Dimensions","The Global Rural-Urban Mapping Project, Version 1 (GRUMPv1): Urban Extent Polygons, Revision 02 is an update to Revision 01, which included new settlements and represented the first time that SEDAC released polygons (in Esri shapefile format) with the settlement name (or name of the largest city in the case of multi-city agglomerations). The shapefile consists of polygons defined by the extent of the nighttime lights and approximated urban extents (circles) based on buffered settlement points. Revision 01 also included new urban extents identified from multiple sources and corrected georeferencing for some settlements (see separate documentation for Global Rural-Urban Mapping Project, Version 1 (GRUMPv1): Settlement Points, Revision 01 for the data and methods). Revision 01 was produced by the Columbia University Center for International Earth Science Information Network (CIESIN) in collaboration with CUNY Institute for Demographic Research (CIDR). Revision 02 was produced by CIESIN.",The Global Rural-Urban Mapping Project (GRUMP) Urban Extent Polygons dataset maps urban settlements in a polygon or shapefile format defined by the extent of nighttime lights and approximated urban areas. These data are useful in studying urbanization and human migration.,Global,"Shapefile, CSV",1 kilometer,1 kilometer,,1995-07-01,,https://doi.org/10.7927/np6p-qe61,GRUMP - Global Rural-Urban Mapping Project,Population and urban extent in shapefile form,"Temporal extent only 1995, Lacks recent data",SEDAC Map widget,Path B,Food Availability,Human Dimensions,https://sciencediscoveryengine.nasa.gov/app/nasa-sba-smd/#/preview?id=%2FSDE%2FCMR_API%2F%7CC2210244511-SEDAC&query=%7B%22name%22%3A%22query-smd-primary%22%2C%22scope%22%3A%22All%22%2C%22text%22%3A%22%22%7D
"Global Subnational Infant Mortality Rates, v1 (2000)",Human Dimensions,"The Poverty Mapping Project: Global Subnational Infant Mortality Rates data set consists of estimates of infant mortality rates for the year 2000. The infant mortality rate for a region or country is defined as the number of children who die before their first birthday for every 1,000 live births. The data products include a shapefile (vector data) of rates, grids (raster data) of rates (per 10,000 live births in order to preserve precision in integer format), births (the rate denominator) and deaths (the rate numerator), and a tabular data set of the same and associated data. Over 10,000 national and subnational units are represented in the tabular and grid data sets, while the shapefile uses approximately 1,000 units in order to protect the intellectual property of source data sets for Brazil, China, and Mexico. This data set is produced by the Columbia University Center for International Earth Science Information Network (CIESIN).","The Poverty Mapping Project: Global Subnational Infant Mortality Rates dataset consists of estimates of infant mortality rates for the year 2000. The infant mortality rate for a region or country is defined as the number of children who die before their first birthday for every 1,000 live births. These data may aid in poverty and human dimensions EJ research.",Global,"ASCII Grid, Excel, Shapefile, PDF, PNG, WMS",,,,2000-01-01 to 2000-12-31,,https://doi.org/10.7927/H4PZ56R2,PMP - Poverty Mapping Project,"Shapefile, grid, and CSV available",Lacks recent data,https://sedac.ciesin.columbia.edu/data/set/povmap-global-subnational-infant-mortality-rates-v2-01/maps,Path B,Human Dimensions,Human Dimensions,https://sciencediscoveryengine.nasa.gov/app/nasa-sba-smd/#/preview?id=%2FSDE%2FCMR_API%2F%7CC179001943-SEDAC&query=%7B%22name%22%3A%22query-smd-primary%22%2C%22scope%22%3A%22All%22%2C%22text%22%3A%22%22%7D
